{
  "$schema": "typed-mat-target-framework-evidence.schema.json",
  "schemaVersion": 1,
  "status": "compiled",
  "project": "src/OpenCvSharp/OpenCvSharp.csproj",
  "frameworks": [ "net46", "net461", "net462", "net47", "net471", "net472", "net48", "net481", "netcoreapp3.1", "net5.0", "net6.0", "net7.0", "net8.0", "net9.0", "net10.0" ],
  "spanPreviewMinimum": "netcoreapp3.1",
  "oldFrameworkPolicy": "MatView and ReadOnlyMatView are excluded by NETCOREAPP3_1_OR_GREATER; raw typed/row APIs remain available",
  "buildConfiguration": "Release",
  "nativeRuntimeRequired": false,
  "limitations": [ "Compilation evidence covers all package TFMs; native owner/lifetime evidence is separately recorded for net8.0 and net10.0 on Windows x64." ]
}
